number,title,created_at,closed_at
1727,How to use zipkin to trace?,2019-01-02T10:01:09Z,2019-04-29T03:27:13Z
1731,[bug] panic: context: internal error: missing cancel error,2019-01-03T03:40:37Z,2019-01-09T01:32:44Z
1732,Can we have a new release?,2019-01-04T06:32:50Z,2019-05-08T01:04:52Z
1734,Using gin.Context together with context.Context ,2019-01-08T07:45:07Z,2019-03-04T22:32:47Z
1737,GO111MODULE run error,2019-01-09T02:44:53Z,2019-01-27T01:39:33Z
1738,no ParseMultipartForm error return in formBinding,2019-01-09T10:12:05Z,2019-01-18T01:32:55Z
1741,Large File Upload Mystery ,2019-01-12T19:52:57Z,2019-01-16T07:09:08Z
1742,"NoRoute writes ""404 page not found"" first",2019-01-14T06:27:05Z,2019-01-14T06:55:27Z
1743,"Its tedious to restart the server, for every small change",2019-01-14T13:25:49Z,2019-03-30T20:45:20Z
1744,Redirect to StaticFIle endpoint panics at first attempt,2019-01-16T10:45:26Z,2019-01-18T01:57:07Z
1746,Something after 1.3.0 breaking string formatting of query params in Default Logger,2019-01-17T23:45:45Z,2019-01-20T00:39:27Z
1748,Gin QPS test is low and cpu low,2019-01-21T02:39:39Z,2019-01-23T03:01:08Z
1750,Unable to use auth middleware in group,2019-01-24T05:11:55Z,2019-01-24T05:16:05Z
1754,How To Use Gin Middleware With Custom HTTP HandlerFunc,2019-01-29T00:00:14Z,2019-01-29T02:08:17Z
1756,wildcard conflicts,2019-01-30T07:03:56Z,2019-01-30T08:29:15Z
1757,pull response time from gin,2019-01-30T14:29:47Z,2019-02-26T07:13:18Z
1758,соре на мусорку,2019-01-31T00:25:21Z,2019-01-31T02:42:33Z
1759,request middleware get relativePath ,2019-02-01T13:16:56Z,2019-10-18T12:02:01Z
1760,Out of range if redirect more than 45 times,2019-02-03T17:48:32Z,2019-02-18T01:35:09Z
1767,Unable to generate code coverage reports,2019-02-08T11:54:04Z,2019-02-18T01:46:50Z
1768,[improvement] logger formatter is not reusable,2019-02-09T15:10:49Z,2019-02-22T08:48:56Z
1769,Generate a template and modify the result before sending it ,2019-02-11T12:14:56Z,2019-02-12T13:19:38Z
1772,"I want to do like bellow nginx conf with gin, so how to do? thanks somebody can help me.",2019-02-15T01:10:38Z,2019-05-10T08:23:48Z
1775,Proposal: split examples to alone repo,2019-02-21T05:58:49Z,2019-03-02T13:34:21Z
1777,utils joinPaths() may be not right,2019-02-22T07:03:45Z,2019-02-22T07:34:22Z
1781,qps setting and graceful shutdown ,2019-02-26T02:42:42Z,2019-05-10T08:23:06Z
1782,gin middleware repo remove go1.6/go1.7 support,2019-02-27T04:54:35Z,2019-03-01T06:33:30Z
1783,ram usage increasing after every request,2019-02-28T07:55:24Z,2019-05-01T11:33:34Z
1784,gin test fail on go master branch,2019-02-28T11:51:17Z,2019-02-28T14:43:39Z
1798,Ignore specified from default router logging?,2019-03-06T00:38:20Z,2020-02-13T12:21:35Z
1804,Default engine producing two log lines with StaticFS for 404,2019-03-09T17:11:35Z,2019-03-11T02:52:48Z
1806,is it possible to handel /index /index.html for one route?,2019-03-10T14:05:12Z,2019-05-19T15:27:38Z
1808,Dynamic routes,2019-03-12T14:57:52Z,2019-03-13T11:53:26Z
1811,cloud.google.com/go@v0.26.0: unrecognized,2019-03-14T00:43:30Z,2019-03-14T00:56:18Z
1813,404 with url like this:  http://localhost:4200//api/auth/login,2019-03-14T16:20:24Z,2019-05-10T08:34:34Z
1815,c.Stream does not work with httptest.ResponseRecorder,2019-03-15T10:03:02Z,2019-03-30T19:43:55Z
1818,Add GitHub explore topic,2019-03-19T02:04:29Z,2019-04-09T14:14:31Z
1821,start new project from Gin build error,2019-03-20T05:53:48Z,2019-05-09T06:47:46Z
1823,Styling breaks when request takes long,2019-03-22T11:44:35Z,2019-03-28T06:14:00Z
1824,Bind JSON and URI ,2019-03-24T07:40:14Z,2019-03-24T15:12:45Z
1825,proposal: add isWebsocket and isIPv6 config to LogFormatterParams,2019-03-26T03:58:17Z,2019-03-28T01:58:48Z
1828,Different packages  and same struct name function  routing error,2019-03-26T10:01:28Z,2019-03-28T01:57:31Z
1832,Official Website is not redirected to https,2019-03-27T20:19:44Z,2019-03-27T20:21:09Z
1833,how could i add a  gin.Contenxt.method() when i new a gin.Engine,2019-03-28T16:50:08Z,2019-03-30T23:11:05Z
1834,Need extensive documentation,2019-03-30T11:24:12Z,2019-03-31T00:32:02Z
1835,"response a json,how could i make the cases ""lowercase""?",2019-04-01T07:02:36Z,2019-05-10T08:14:05Z
1837,GIN_MODE set in .env file does not take effect,2019-04-03T08:26:53Z,2019-04-03T11:19:03Z
1839,Vendor dependency cells-v1.4.1 having AGPL 3.0 licenses,2019-04-03T13:41:22Z,2019-05-19T15:34:19Z
1844,Please rollback README before new documents are ready,2019-04-04T06:48:32Z,2019-04-06T13:51:01Z
1845,Binding multipart.FileHeader but not working,2019-04-04T18:23:36Z,2019-04-06T07:29:48Z
1850,"Cannot find package ""github.com/golang/protobuf/proto""...",2019-04-07T09:24:08Z,2019-04-08T11:54:08Z
1855,There is no way to protect from csrf attack in gin-goind,2019-04-14T12:21:29Z,2019-06-07T06:15:37Z
1857,"If the graceful closing of the port being listened to, does not make the code I am executing uninterrupted?",2019-04-18T09:40:05Z,2019-04-22T01:39:30Z
1858,Facing issues when passing an array of json objects in the post request,2019-04-19T10:31:56Z,2019-04-19T11:25:36Z
1859,Force SSL on Heroku,2019-04-19T13:57:15Z,2019-04-23T13:54:59Z
1860,Similar URL strange bug,2019-04-22T00:13:38Z,2019-04-22T22:25:39Z
1862,How to upload file directory,2019-04-23T11:12:16Z,2019-04-26T04:34:10Z
1863,How do you think bilibili-common a China company leaked code copy from gin?,2019-04-23T11:26:35Z,2019-04-24T10:29:05Z
1864,write tcp 127.0.0.1:7070->127.0.0.1:34514: write: connection reset by peer,2019-04-23T15:01:19Z,2019-04-26T12:17:54Z
1869,convert http.Request to gin.context,2019-04-26T09:21:44Z,2019-08-23T21:10:51Z
1870,"handFunc in another file, report undefined",2019-04-26T09:50:03Z,2019-04-28T03:09:53Z
1871,how to transform gin.Context.Keys  use Reverse Proxy ,2019-04-27T09:18:35Z,2019-04-28T11:16:56Z
1872,How can I get user/password from url with gin,2019-04-27T09:28:22Z,2019-04-28T01:55:21Z
1874,how to set timeout in Reverse proxy ,2019-04-28T02:41:20Z,2019-04-28T10:58:41Z
1875,gin.Context.Keys,2019-04-28T06:02:08Z,2019-05-19T15:27:02Z
1877,Provide a way to set custom DEBUG logger,2019-04-30T15:58:59Z,2019-11-14T12:51:31Z
1878,how to binding for multi files upload,2019-05-02T05:01:04Z,2019-06-18T11:49:11Z
1882,gin release process,2019-05-05T21:41:16Z,2019-05-08T01:14:02Z
1884,I'm new.How to write test in jin?,2019-05-06T13:28:57Z,2019-05-09T11:19:19Z
1887,"gin/json package not found,when i use golang1.12.5 version.",2019-05-08T14:55:37Z,2019-05-10T07:45:57Z
1888,Url param does not support top-level path binding,2019-05-09T02:34:01Z,2019-05-09T06:51:06Z
1889,How do I know that the browser is disconnecting this connection?,2019-05-09T09:32:15Z,2019-05-09T11:18:18Z
1890,Debug mode documentation incorrect,2019-05-09T19:30:30Z,2019-05-10T06:03:26Z
1894,"During the running of the program, Engine.trees was tampered with, causing some api 404",2019-05-10T14:14:27Z,2019-05-11T10:58:46Z
1895,how counting up a variable in range from 1 to n，isn't start 0,2019-05-12T23:10:17Z,2019-05-13T02:25:59Z
1897,use gin v1.4.0 build error ambiguous import,2019-05-13T06:46:37Z,2019-05-13T06:53:51Z
1899,Binding isn't throwing an error,2019-05-13T22:23:38Z,2019-05-18T10:57:24Z
1900,"hi，I want  use http.server config ,like ReadTimeout, disableKeepAlives",2019-05-14T03:22:13Z,2019-06-17T10:33:12Z
1901,MaxMultipartMemory not working,2019-05-15T06:28:18Z,2019-05-15T07:40:08Z
1903,Unable to use middlewares with latest Gin?,2019-05-16T05:43:43Z,2019-05-16T05:47:44Z
1904,conflict wildcard with difference endpoint name,2019-05-17T04:31:06Z,2019-05-18T10:46:17Z
1905,context.Abort + context.JSON and context.AbortWithStatusJSON mismatch,2019-05-18T03:36:43Z,2019-05-18T04:57:42Z
1907,Correct way to validate forms (json binding),2019-05-20T15:15:39Z,2019-10-10T16:58:25Z
1908,error description of release v1.4.0,2019-05-20T15:53:02Z,2019-05-21T03:24:01Z
1910,govendor  修改成gomod  之后， go mod 报github.com/ugorji/go版本不对,2019-05-22T07:46:14Z,2019-05-22T13:45:40Z
1911,Drop govendor support,2019-05-22T15:07:06Z,2019-11-25T07:42:24Z
1912,Drop go1.8/go1.9 support,2019-05-22T15:15:39Z,2019-06-28T15:43:08Z
1914,"Pr, Add Or middleware for gin.Context",2019-05-24T10:10:13Z,2019-06-10T06:52:46Z
1915,the redirection problem,2019-05-25T01:15:30Z,2019-06-07T06:07:38Z
1917,Wrong matched route path in the context,2019-05-28T10:06:02Z,2019-06-29T01:54:26Z
1925,Unexcepted behaviour if file field present,2019-06-03T12:50:39Z,2019-06-07T06:01:43Z
1927,It seems there's cache when use c.PostForm,2019-06-04T10:26:13Z,2019-06-12T13:09:18Z
1928,Unexpected behaviour with ShouldBindJSON with default value,2019-06-04T19:17:20Z,2019-06-06T01:41:13Z
1929,"current panic make cpu skyrocket to 96%+,maybe this is bug.",2019-06-05T14:57:39Z,2019-11-23T09:56:13Z
1930,Get Request Status 200 OK but no data sent,2019-06-06T00:37:25Z,2019-06-07T05:49:34Z
1934,Set the cookie attribute “SameSite = None”,2019-06-07T03:47:09Z,2020-01-20T07:13:33Z
1935,Error in json binding,2019-06-07T05:58:22Z,2019-06-07T06:25:03Z
1942,"request cause panic with v1.4.0 @ form_mapping.go:63 ~ form_mapping.go:89  ,  be careful",2019-06-10T07:50:57Z,2019-11-01T02:47:41Z
1945,Gin Parameters of the receiving form cache issue,2019-06-11T06:37:08Z,2019-06-12T13:09:45Z
1946,How to open the callback function after startup?,2019-06-12T03:39:23Z,2019-06-12T13:09:33Z
1948,some code not exist,2019-06-12T16:25:40Z,2019-06-12T16:36:11Z
1950,"binding:""required"" failed",2019-06-13T10:08:10Z,2019-06-14T07:56:21Z
1952,how to handle error in router handlerFunc?,2019-06-15T02:35:30Z,2019-07-05T01:53:39Z
1954,Which companies use gin-gonic/gin in production?,2019-06-18T07:18:32Z,2019-08-29T00:09:49Z
1955,something wrong with Context.FullPath(),2019-06-18T09:20:55Z,2019-06-18T11:50:31Z
1956,support bind http header param,2019-06-18T11:15:34Z,2019-06-27T05:01:01Z
1958,How to upload folder,2019-06-20T03:51:06Z,2019-06-20T04:40:57Z
1959,gin-gonic does not listen,2019-06-20T04:11:37Z,2019-06-20T04:40:15Z
1960,`go get gin` error. It context.go file has too many error?,2019-06-21T08:52:26Z,2019-06-30T14:34:47Z
1962,why not move the temp file rather than copy the same file when upload a large file?,2019-06-25T13:21:46Z,2019-06-30T02:36:22Z
1964,How do I limit the number of connections?,2019-06-26T07:39:50Z,2019-07-03T03:02:16Z
1965,Errors in startup and operation of the latest version,2019-06-29T07:38:43Z,2019-06-29T07:45:17Z
1972,Gin Project Scaffolding CLI is highly neeeded,2019-07-04T02:26:52Z,2019-07-13T23:55:55Z
1975, write: broken pipe,2019-07-04T07:13:04Z,2019-07-09T22:50:07Z
1976,please upgrade gopkg.in/go-playground/validator.v8,2019-07-05T02:57:58Z,2019-07-05T03:02:33Z
1979,"binding:extended time.Time type, support Unix time",2019-07-06T08:21:39Z,2019-07-10T05:03:03Z
1982,"Encountered a strange phenomenon: when I accessed api  in vscode debugger,  no response will be received , but It will  receive  while go build",2019-07-08T15:47:39Z,2019-07-09T22:49:02Z
1983,which version tag supports go 1.9,2019-07-09T02:16:22Z,2019-07-09T22:47:31Z
1984,gin.Conext.Bind not working properly for application/json POST request body,2019-07-11T19:00:47Z,2019-07-12T08:31:13Z
1986,How to get the route path in context,2019-07-12T10:01:36Z,2019-07-12T10:35:09Z
1987,what is the code block({}) use?,2019-07-12T11:33:35Z,2019-07-13T23:55:02Z
1988,c.Request.FormFile is ridiculously slow sometimes,2019-07-12T12:15:22Z,2019-07-13T23:53:09Z
1990,restful uri conflicts with existing wildcard,2019-07-15T10:13:28Z,2019-07-16T01:16:11Z
1992,restfull api,2019-07-16T12:24:58Z,2019-07-16T12:41:34Z
1993,路由前缀一致导致的冲突问题,2019-07-17T05:36:39Z,2019-07-17T05:58:39Z
1994,How can render a templete with a templete file and some html piece into it,2019-07-17T11:50:39Z,2019-07-17T12:20:50Z
1997,LoggerWithFormatter and gin.Context,2019-07-22T13:32:57Z,2019-11-06T10:50:13Z
1998,make post request with out http library,2019-07-24T03:18:26Z,2019-08-29T00:08:46Z
2001,context.ShouldBindHeader undefined,2019-07-25T08:01:33Z,2019-07-26T09:14:45Z
2002,Can not bind using POST (time),2019-07-25T18:36:35Z,2019-07-29T16:35:29Z
2003,Occassionally  Context.JSON Cost 15 Minute,2019-07-26T03:28:43Z,2019-07-27T01:21:00Z
2005,conflicts with existing wildcard,2019-07-30T04:07:14Z,2019-07-30T04:51:24Z
2009,can't parse unix timestamp,2019-08-07T07:17:44Z,2019-08-07T15:55:38Z
2012,Why does context.Status() writes through writermem?,2019-08-09T13:15:50Z,2019-08-09T14:13:33Z
2021,parse map params failed!!!,2019-08-17T04:08:53Z,2019-08-19T07:36:54Z
2022,fullPath not matched with request url,2019-08-17T09:25:09Z,2019-10-11T13:10:30Z
2024,How to carry data when redirecting,2019-08-19T08:33:50Z,2019-11-05T01:18:02Z
2027,How to troubleshoot crashes,2019-08-22T11:27:54Z,2019-08-23T21:10:01Z
2030,time binding tag time_format is not suitable for json,2019-08-28T02:17:42Z,2019-08-29T00:06:45Z
2032,set&get cookie not work,2019-08-28T03:21:07Z,2019-08-28T05:39:00Z
2033,url query params to map,2019-08-29T09:48:51Z,2019-08-29T09:49:01Z
2034,Is there a wildcard routing similar to JAVA?,2019-08-29T12:33:57Z,2019-09-13T01:34:15Z
2036,Segment download error ,2019-09-03T02:36:26Z,2019-09-04T00:02:20Z
2039,New release?,2019-09-04T09:52:36Z,2019-10-27T09:35:01Z
2042,Terminal Output Values,2019-09-06T05:39:30Z,2019-09-06T05:56:43Z
2043,"Context.Set(key, value) map not goroutine safe",2019-09-06T08:03:29Z,2019-09-06T09:12:03Z
2044,How to bind int slice in form request,2019-09-06T08:08:53Z,2019-09-06T08:35:02Z
2048,Broken Pipe error,2019-09-08T02:29:01Z,2019-09-10T08:43:04Z
2050,Build / go.mod error for github.com/ugorji/go/codec,2019-09-09T13:34:37Z,2019-09-10T08:40:48Z
2062,conflicts with existing wildcard,2019-09-19T11:51:25Z,2019-09-19T23:18:25Z
2065,POST request not consuming all of body,2019-09-23T15:24:50Z,2019-09-26T18:18:16Z
2066,POST request consuming only some part of the body,2019-09-23T15:24:50Z,2019-09-26T18:17:56Z
2076,Function ClientIP() may lead to potential risks,2019-09-25T23:09:52Z,2020-01-27T16:04:50Z
2077,can i use gopkg.in/go-playground/validator.v9?,2019-09-27T09:36:19Z,2019-09-27T09:54:03Z
2082,Does BindUri works with POST/PATCH/PUT methods?,2019-10-02T16:35:37Z,2019-10-08T20:22:46Z
2084,redirecting to the docker container,2019-10-05T14:06:48Z,2019-10-11T08:51:10Z
2087,Context.JSON response wrong Content-Type and unknown keyword Content-Regulation,2019-10-08T07:51:04Z,2019-10-12T08:38:56Z
2089,multiple modules,2019-10-09T05:17:01Z,2019-10-11T13:06:29Z
2091,When will  call the v1.5 tag?,2019-10-12T09:42:36Z,2019-10-27T09:34:23Z
2098,How to jsoniter LowerCaseWithUnderscores(),2019-10-14T18:21:08Z,2019-10-22T13:46:25Z
2099,need to update readme and examples because validator has upgraded to v9,2019-10-17T09:50:01Z,2019-11-20T03:09:08Z
2100,Avoid parsing query strings every time ctx.Query() is called,2019-10-17T20:14:18Z,2019-10-21T15:52:19Z
2101,Question of gin.engine.trees,2019-10-18T10:31:02Z,2019-10-20T13:27:55Z
2104,file close?,2019-10-24T03:04:40Z,2019-11-01T03:18:24Z
2107,panic: fatal error: concurrent map writes,2019-10-25T13:44:03Z,2019-11-18T14:48:50Z
2111,DataFromReader with nil extraHeaders crashes,2019-10-28T10:47:20Z,2019-11-25T02:45:54Z
2113,"After gin middleware c.Next, if an exception is thrown, the following code can't get the error code.",2019-10-29T05:53:09Z,2019-11-13T02:15:57Z
2115,how to disable gin log,2019-10-29T09:58:07Z,2019-10-31T03:39:44Z
2116,DisallowUnknownFields undefined ,2019-10-30T07:50:22Z,2019-11-01T08:53:39Z
2117,Bug: Static file handler does not close files,2019-10-30T14:50:52Z,2019-10-31T14:52:03Z
2123,How can i use http2 with Let's Encrypt?,2019-11-05T07:49:15Z,2019-11-13T06:55:52Z
2127,fix github.com/ugorji/go import!,2019-11-07T16:09:21Z,2019-11-07T16:13:26Z
2128,Slow release cadence,2019-11-08T11:35:48Z,2019-12-03T13:07:23Z
2130,Please upgrade go-validator to v10,2019-11-12T10:50:47Z,2019-11-25T06:49:45Z
2131,JSON Binding when incorrect type is passed in,2019-11-12T17:35:08Z,2019-11-13T09:37:54Z
2132,default value binding failed,2019-11-14T09:35:10Z,2019-11-14T12:50:10Z
2133,Does Bind still not support the []* multipart.fileheader type,2019-11-14T13:09:06Z,2019-11-28T08:16:10Z
2134,gin mode unknown: debug,2019-11-14T17:04:47Z,2019-11-15T08:23:02Z
2140,func (*Context) FullPath in documentation but not released yet,2019-11-20T09:53:26Z,2019-12-03T13:06:25Z
2142,Templating language reference?,2019-11-20T11:06:10Z,2019-12-03T10:52:38Z
2144,Can't get nested validation working regardless of `dive` usage,2019-11-21T18:18:15Z,2019-11-21T18:54:20Z
2145,"ShouldBindBody, when used as as described in the README, throws a compile error.",2019-11-22T04:29:45Z,2019-11-25T17:12:15Z
2146,"gin render/json.go:58 panic cause cpu90%+,maybe this is a bug.",2019-11-23T09:21:51Z,2019-11-23T09:55:02Z
2151,"Is there a error when importing ""github.com/go-playground/validator/v10""",2019-11-25T11:37:45Z,2019-11-29T04:14:07Z
2152,Question on routes grouping,2019-11-25T13:45:10Z,2019-11-26T09:39:25Z
2154,file,2019-11-26T11:54:03Z,2019-11-26T11:54:46Z
2158,[Break-Backward] use encode replace json marshal increase json encoder speed not in release notes,2019-11-27T11:35:45Z,2019-11-28T05:41:40Z
2160,Undefined validation function 'exists' on field,2019-11-29T07:31:17Z,2020-03-26T09:55:19Z
2161,Getting new gin version is failing,2019-11-29T14:38:29Z,2020-02-08T11:56:28Z
2167,examples about validator.v9 Translations & Custom Errors,2019-12-05T13:22:00Z,2019-12-18T07:49:23Z
2168,Log Color,2019-12-05T13:46:13Z,2019-12-06T03:57:08Z
2176,can i use v10 in gin? and how to?,2019-12-09T04:07:05Z,2019-12-18T13:05:50Z
2184,"using gin.DefaultWriter = io.MultiWriter(f, os.Stdout) can't write to log file",2019-12-12T14:53:33Z,2019-12-19T13:22:14Z
2185,"can't parse ""+"" when binding models ",2019-12-12T15:18:35Z,2019-12-13T10:10:36Z
2197,How to reset queryCache?,2019-12-30T01:51:10Z,2020-01-30T06:40:54Z
2200,cache static files (js and css files),2020-01-02T14:36:35Z,2020-01-12T11:06:15Z
2204,add middleware to serving static files,2020-01-10T13:08:28Z,2020-01-10T13:34:23Z
2205,strange behavior serving static files,2020-01-10T18:17:29Z,2020-01-13T11:26:16Z
2207,C.copy() does not work.,2020-01-14T11:36:09Z,2020-01-15T08:09:42Z
2209,context.JSON adds a new line to end of JSON response,2020-01-15T14:40:54Z,2020-02-21T09:15:18Z
2214,SetCookie broken,2020-01-20T11:24:21Z,2020-01-22T23:54:09Z
2221,app.Use() middleware does not respect ctx.Next(),2020-01-27T01:46:48Z,2020-02-04T03:19:22Z
2225,"Google Cloud Function,  ""Function panic: handlers are already registered for path""",2020-02-05T18:06:50Z,2020-02-05T22:52:27Z
2230,how can i get query param from the url?,2020-02-09T16:49:52Z,2020-02-09T17:05:44Z
2235,Binding Problem on request with semicolon(;) as delimiter,2020-02-17T01:35:06Z,2020-02-17T05:11:58Z
2236,Add TODOs Badge to README,2020-02-17T20:48:15Z,2020-02-21T08:33:37Z
2238,why this is empty?,2020-02-21T03:46:25Z,2020-02-22T12:11:47Z
2239,"Mutliple slashes in the url,like ////a////b will match /a/b",2020-02-21T06:20:32Z,2020-02-21T07:27:39Z
2243,[Question] How to return XML data whose root node is <xml>,2020-02-21T17:09:00Z,2020-03-01T04:52:44Z
2244,Shouldn't ShouldBindJson return an error when the request body doesn't match the structure?,2020-02-22T02:52:16Z,2020-04-08T18:07:04Z
2245,use github actions instead of travisci,2020-02-23T06:25:44Z,2020-02-26T02:12:30Z
2266,Using writer function in go GIN to send response to endpoint from yaml file,2020-02-27T00:39:23Z,2020-02-27T18:42:32Z
2268,Release v1.6 version,2020-02-27T05:55:15Z,2020-03-22T04:28:47Z
2275,(*Context).Render: panic(err),2020-03-01T14:45:06Z,2020-03-02T13:22:13Z
2286,How to support root level wildcard parameters in path?,2020-03-18T15:06:32Z,2020-03-21T12:47:40Z
2287,"Timeout: It spend 31m45s, I don't know why since all time consuming is done.",2020-03-20T09:26:34Z,2020-03-20T12:42:07Z
2289,conflicts with existing children in path,2020-03-22T00:53:12Z,2020-03-22T01:28:36Z
2292,"New behavior of r.Run binds to localhost, not 0.0.0.0, issues in Docker",2020-03-23T02:58:00Z,2020-03-23T09:48:26Z
2299,breaking change to v1.6.0 is inappropriate,2020-03-25T02:52:22Z,2020-03-27T02:47:23Z
2301,got panic with RWMutex on 1.6.0 version ,2020-03-26T03:46:15Z,2020-03-27T02:57:37Z
2304,Allow gin.Engine To Shutdown,2020-03-26T22:21:44Z,2020-04-08T15:28:48Z
2308,SetCookie broken again,2020-03-30T12:16:44Z,2020-04-08T15:31:41Z
2310,Validator path should be GitHub version?,2020-04-03T06:44:00Z,2020-04-03T14:57:55Z
2314,Validator panics with datetime field,2020-04-05T14:09:17Z,2020-04-05T14:11:50Z
